row_id,board_id,pin_title,pin_description,pin_link,pin_alt_text,media_url,publish_at,status
exp-20260713-beans-98g-protein-per-dollar,1124140825679548780,Beans: 98g of Protein Per Dollar. Chicken Legs: 50g. Eggs: 34g.,"We priced 49 foods with USDA protein data and July 2026 store prices. Dried pinto beans deliver 98 grams of protein per dollar, chicken drumsticks 50, eggs 34, bacon 9. See the full cheap protein ranking plus a week of budget meals built from the top three.",https://www.daily-life-hacks.com/beans-98g-protein-per-dollar/,"A jar of dried beans, chicken drumsticks, and eggs with a chalkboard showing protein-per-dollar numbers 98, 50, 34.",/images/pins/beans-98g-protein-per-dollar.jpg,2026-07-17T15:06:00,PENDING
exp-20260713-build-day-dry-goods-aisle,1124140825679548779,Build Your Day From the Dry Goods Aisle: 30g of Fiber for 62 Cents,"The cheapest way to hit 30 grams of fiber a day is the dry goods aisle: beans, lentils, oats, and rice for 62 cents. See the meal-by-meal math from USDA fiber data and real store prices, plus four pricier days for comparison.",https://www.daily-life-hacks.com/build-day-dry-goods-aisle/,"Cloth bags of dried black beans and lentils with measuring cups, a bowl of cooked rice, and a notebook of fiber math on a wooden counter.",/images/pins/build-day-dry-goods-aisle.jpg,2026-07-22T19:55:00,PENDING
exp-20260713-stop-paying-protein-it-costs,1124140825679548780,Stop Paying $10 for Protein When It Costs Less Than a Dollar,"Hitting 50 grams of protein costs 82 cents from the dry goods aisle or $9.97 from the drive-thru. Same protein, 12x the price. See all five days priced meal by meal with USDA protein data and July 2026 prices.",https://www.daily-life-hacks.com/stop-paying-protein-it-costs/,Jars of dried beans and a carton of eggs on a kitchen counter beside a McDonald's takeout bag by a window.,/images/pins/stop-paying-protein-it-costs.jpg,2026-07-26T20:58:00,PENDING
exp-20260713-restaurant-fiber-meal-costs-same,1124140825679548779,That Restaurant Fiber Meal Costs $14.42. The Same Fiber at Home Costs 62 Cents.,"A day of 30 grams of fiber costs $14.42 from restaurants or 62 cents from the dry goods aisle. Same fiber, 23x the price. See all five days priced meal by meal with USDA data and real menus.",https://www.daily-life-hacks.com/restaurant-fiber-meal-costs-same/,Split view of a restaurant receipt totaling $14.42 beside paper bags of dried beans and oats with a 62 cent price card and a quarter.,/images/pins/restaurant-fiber-meal-costs-same.jpg,2026-08-02T14:40:00,PENDING
exp-20260713-protein-days-priced-dry-goods,1124140825679548780,5 Protein Days Priced: From 82 Cents to $9.97,"Five real ways to hit 50 grams of protein in one day, each priced meal by meal: dry goods 82 cents, no-cook $2.05, meat-eater $2.78, realistic mixed $1.51, drive-thru $9.97. USDA protein data, July 2026 prices. See every meal and every number.",https://www.daily-life-hacks.com/protein-days-priced-dry-goods/,"Five meal prep containers in a row holding black beans, hard boiled eggs, diced chicken, and yogurt, ending with a plain brown takeout bag, under the headline 5 Protein Days Priced From 82 Cents to $9.97.",/images/pins/protein-days-priced-dry-goods.jpg,2026-08-03T14:02:00,PENDING
exp-20260713-only-foods-you-need-high,1124140825679548780,The Only 3 Foods You Need for High Protein on a Budget,"Dried beans, eggs, and chicken drumsticks cover a week of high protein meals for a few dollars a day. Real July 2026 prices, USDA protein numbers, and a simple 7-day budget meal rotation you can copy tonight.",https://www.daily-life-hacks.com/only-foods-you-need-high/,"A bowl of pinto beans, roasted chicken drumsticks, and two fried eggs beside a handwritten weekly meal plan.",/images/pins/only-foods-you-need-high.jpg,2026-08-05T19:57:00,PENDING
