"2026-03-20 11:57","Better than store bought! Creamy high-fiber hummus recipe with extra chickpeas and tahini. Perfect dip for veggies. #HummusRecipe #HealthyDip #HighFiberSnack #Hummus #HealthySnack #PlantBased #HighFiber #MediterraneanFood","https://www.daily-life-hacks.com/high-fiber-hummus-recipe-homemade-guide","https://www.daily-life-hacks.com/images/pins/high-fiber-hummus-recipe-homemade_v2.jpg","High Fiber Hummus Recipe Homemade Guide","","High Fiber Hummus Recipe Homemade - professionally plated meal with fresh vegetables, chickpeas for healthy snacking","","High Fiber Recipes","","",""
"2026-03-20 12:37","Sweet and Savory. Pear, Walnut and Blue Cheese salad. Pears are one of the highest fiber fruits! #PearSalad #HealthyDinner #HighFiberRecipes #SaladRecipe #HighFiberFruit #HealthyEating #GourmetSalad #GutHealth","https://www.daily-life-hacks.com/pear-salad-with-walnuts-fiber-rich-guide","https://www.daily-life-hacks.com/images/pins/pear-salad-with-walnuts-fiber-rich_v1.jpg","Pear Salad with Walnuts Fiber Rich Guide","","Pear Salad with Walnuts Fiber Rich - professionally plated meal for natural nutrition","","High Fiber Recipes","","",""
"2026-03-20 15:29","Tired of your cilantro turning into green slime? Here is exactly how to store fresh herbs to last longer and save money.

#MealPrep #KitchenTips #HealthyEating #FoodStorage #BudgetMeals #MealPrepSunday #CleanEating #HealthyLifestyle","https://www.daily-life-hacks.com/how-to-store-fresh-herbs-so-they-last-longer","https://www.daily-life-hacks.com/images/pins/how-to-store-fresh-herbs-to-last-longer_v3.jpg","How to Store Fresh Herbs So They Last Longer","","How to Store Fresh Herbs So They Last Longer - healthy tips tips","","Healthy Meal Prep & Kitchen Tips","","",""
"2026-03-20 16:34","Oatmeal vs. grits is one of those breakfast comparisons that gets easier once you see the fiber difference side by side. #OatmealVsGrits #FiberComparison #HealthyBreakfast #BreakfastIdeas #WholeGrains #NutritionTips #SimpleChoices #MorningMeals","https://www.daily-life-hacks.com/oatmeal-vs-grits-fiber-content","https://www.daily-life-hacks.com/images/pins/oatmeal-vs-grits-fiber-content_v1.jpg","Oatmeal Vs Grits Fiber Content","","Two breakfast bowls side by side with oatmeal toppings and warm grits for an easy fiber comparison","","Gut Health & Nutrition Tips","","",""
"2026-03-21 09:11","Fiber works best when your hydration habits keep up. This simple guide breaks down the water and fiber balance that helps meals feel more comfortable day to day. #Hydration #FiberTips #GutHealth #HealthyHabits #NutritionTips #DailyWellness #BalancedEating #SimpleHealth","https://www.daily-life-hacks.com/best-water-and-fiber-the-golden-rule","https://www.daily-life-hacks.com/images/pins/water-and-fiber-the-golden-rule_v4.jpg","Best Water and Fiber the Golden Rule","","Water and Fiber The Golden Rule - simple hydration and fiber foods arranged for an everyday wellness guide","","Gut Health & Nutrition Tips","","",""
"2026-03-21 11:54","Popcorn and potato chips may both feel snacky, but the fiber difference makes them a very different fit for everyday snacking. #SnackSwap #FiberFacts #HealthyChoices #SnackIdeas #Popcorn #PotatoChips #SimpleComparison #EverydayNutrition","https://www.daily-life-hacks.com/popcorn-vs-potato-chips-fiber-comparison-guide","https://www.daily-life-hacks.com/images/pins/popcorn-vs-potato-chips-fiber-comparison_v2.jpg","Popcorn Vs Potato Chips Fiber Comparison Guide","","Bowl of popcorn and bowl of potato chips arranged side by side for a quick snack comparison","","Gut Health & Nutrition Tips","","",""
"2026-03-21 13:43","Stop throwing money in the trash. Discover how to reduce food waste at home with easy tips that actually fit into your busy schedule.

#MealPrep #KitchenTips #HealthyEating #FoodStorage #BudgetMeals #MealPrepSunday #CleanEating #HealthyLifestyle","https://www.daily-life-hacks.com/how-to-reduce-food-waste-at-home-easy-tips-tips","https://www.daily-life-hacks.com/images/pins/how-to-reduce-food-waste-at-home-easy-tips_v3.jpg","How to Reduce Food Waste At Home Easy Tips Tips","","How to Reduce Food Waste At Home Easy Tips Tips - healthy tips tips","","Healthy Meal Prep & Kitchen Tips","","",""
"2026-03-21 14:53","Plant-based power! 5 Days of vegan high-fiber lunches. Tofu, quinoa, roasted veggies. Cheap and easy prep. #VeganMealPrep #HighFiberVegan #PlantBased #VeganPrep #MealPrepSunday #HighFiber #PlantPower #HealthyLunch","https://www.daily-life-hacks.com/vegan-high-fiber-meal-prep-for-week-tips","https://www.daily-life-hacks.com/images/pins/vegan-high-fiber-meal-prep-for-week_v2.jpg","Vegan High Fiber Meal Prep for Week Tips","","Vegan High Fiber Meal Prep for Week - fresh meal in glass containers with fresh vegetables, whole grains for natural nutrition","","High Fiber Recipes","","",""
"2026-03-21 16:47","Whole wheat pasta and white pasta can look similar on the plate, but the fiber difference changes how filling the meal feels. #WholeWheat #PastaComparison #HighFiber #HealthySwaps #WholeGrains #EasyMeals #NutritionTips #SimpleChoices","https://www.daily-life-hacks.com/whole-wheat-pasta-vs-white-pasta-fiber","https://www.daily-life-hacks.com/images/pins/whole-wheat-vs-white-pasta-fiber_v3.jpg","Whole Wheat Pasta Vs White Pasta Fiber","","Cooked whole wheat pasta and white pasta plated side by side for a simple fiber comparison","","Gut Health & Nutrition Tips","","",""
"2026-03-22 09:46","Sick of your expensive avocados turning brown immediately? Discover the best way to store avocados to stop browning and save your guacamole.

#MealPrep #KitchenTips #HealthyEating #FoodStorage #BudgetMeals #MealPrepSunday #CleanEating #HealthyLifestyle","https://www.daily-life-hacks.com/how-to-store-cut-avocado-without-it-turning-brown","https://www.daily-life-hacks.com/images/pins/best-way-to-store-avocados-to-stop-browning_v2.jpg","How to Store Cut Avocado Without It Turning Brown","","How to Store Cut Avocado Without It Turning Brown - healthy tips tips","","Healthy Meal Prep & Kitchen Tips","","",""
"2026-03-22 11:15","Low carb, high fiber! 5 delicious cauliflower rice recipes that taste like the real thing. Fried rice, burrito bowls and more. #CauliflowerRice #KetoRecipes #HighFiber #CauliflowerRice #LowCarb #HighFiber #KetoDinner #VeggieLoaded","https://www.daily-life-hacks.com/high-fiber-cauliflower-rice-recipes-tips","https://www.daily-life-hacks.com/images/pins/high-fiber-cauliflower-rice-recipes_v2.jpg","High Fiber Cauliflower Rice Recipes Tips","","High Fiber Cauliflower Rice Recipes - dynamic cooking action shot for natural nutrition","","High Fiber Recipes","","",""
"2026-03-22 13:49","Buying good bread shouldn't mean rushing to eat it in two days. Here is how to keep bread fresh longer without mold taking over your loaf.

#MealPrep #KitchenTips #HealthyEating #FoodStorage #BudgetMeals #MealPrepSunday #CleanEating #HealthyLifestyle","https://www.daily-life-hacks.com/how-to-keep-bread-fresh-longer-without-mold-guide","https://www.daily-life-hacks.com/images/pins/how-to-keep-bread-fresh-longer-without-mold_v4.jpg","How to Keep Bread Fresh Longer Without Mold Guide","","How to Keep Bread Fresh Longer Without Mold Guide - healthy tips tips","","Healthy Meal Prep & Kitchen Tips","","",""
"2026-03-22 14:57","Feeling confused in the grocery aisle? Here is a dead simple guide on how to read nutrition labels for beginners without needing a science degree.

#MealPrep #KitchenTips #HealthyEating #FoodStorage #BudgetMeals #MealPrepSunday #CleanEating #HealthyLifestyle","https://www.daily-life-hacks.com/how-to-read-nutrition-labels-total-fat","https://www.daily-life-hacks.com/images/pins/how-to-read-nutrition-labels-for-beginners_v1.jpg","How to Read Nutrition Labels Total Fat","","How to Read Nutrition Labels Total Fat - healthy tips tips","","Healthy Meal Prep & Kitchen Tips","","",""
"2026-03-22 16:58","Eating well doesn't have to cost a fortune. Grab this exact grocery shopping list for healthy eating on a budget and start saving immediately.

#MealPrep #KitchenTips #HealthyEating #FoodStorage #BudgetMeals #MealPrepSunday #CleanEating #HealthyLifestyle","https://www.daily-life-hacks.com/grocery-shopping-list-for-healthy-eating-on-a-budget-guide","https://www.daily-life-hacks.com/images/pins/grocery-shopping-list-for-healthy-eating-on-a-budget_v2.jpg","Grocery Shopping List for Healthy Eating on a Budget Guide","","Grocery Shopping List for Healthy Eating on a Budget Guide - healthy tips tips","","Healthy Meal Prep & Kitchen Tips","","",""
"2026-03-23 09:46","Stuck at a drive-thru? This guide rounds up practical high-fiber fast food picks from places like Subway, Chipotle, and Starbucks for busier days. #FastFoodHacks #HealthyOnTheGo #HighFiber #QuickMeals #NutritionTips #EatingOut #SimpleChoices #BusyDays","https://www.daily-life-hacks.com/high-fiber-fast-food-options-guide","https://www.daily-life-hacks.com/images/pins/high-fiber-fast-food-options-guide_v1.jpg","High Fiber Fast Food Options Guide","","Takeout-style meal with beans, grains, vegetables, and toppings arranged on a tray for a quick comparison guide","","Gut Health & Nutrition Tips","","",""
"2026-03-23 11:18","The underrated superfood! Steamed artichoke with lemon garlic dip. One of the highest fiber vegetables you can eat. #ArtichokeRecipes #GutHealth #HighFiberVeggies #Artichoke #Superfood #FiberRich #GutHealth #VegetarianDinner","https://www.daily-life-hacks.com/is-artichoke-good-for-your-stomach","https://www.daily-life-hacks.com/images/pins/artichoke-recipes-for-gut-health_v1.jpg","Is Artichoke Good for Your Stomach","","Artichoke Recipes for Gut Health - appetizing bowl with colorful ingredients with fresh vegetables for natural nutrition","","High Fiber Recipes","","",""
"2026-03-23 12:45","Fresh parsley, bulgur, cucumber, and lemon make this tabbouleh feel bright, hearty, and easy to prep ahead. #Tabbouleh #MediterraneanFood #HighFiberLunch #HealthyLunch #BulgurSalad #MealPrep #FreshRecipes #VeganRecipes","https://www.daily-life-hacks.com/tabbouleh-salad-high-fiber-bulgur","https://www.daily-life-hacks.com/images/pins/tabbouleh-salad-high-fiber-bulgur_v4.jpg","Tabbouleh Salad High Fiber Bulgur","","Tabbouleh Salad High Fiber Bulgur - fresh parsley salad with bulgur, tomatoes, and cucumber for a bright Mediterranean lunch","","High Fiber Recipes","","",""
"2026-03-23 15:43","Plant-based power! 5 Days of vegan high-fiber lunches. Tofu, quinoa, roasted veggies. Cheap and easy prep. #VeganMealPrep #HighFiberVegan #PlantBased #VeganPrep #MealPrepSunday #HighFiber #PlantPower #HealthyLunch","https://www.daily-life-hacks.com/vegan-high-fiber-meal-prep-for-week","https://www.daily-life-hacks.com/images/pins/vegan-high-fiber-meal-prep-for-week_v4.jpg","Vegan High Fiber Meal Prep for Week","","Vegan High Fiber Meal Prep for Week - fresh meal in glass containers with fresh vegetables, whole grains for natural nutrition","","High Fiber Recipes","","",""
"2026-03-23 16:38","Dinner in 10 mins. High Fiber Veggie Stir-Fry with broccoli, snap peas and peppers. Low calorie volume eating. #StirFry #VeggieDinner #HighFiber #StirFry #HealthyDinner #VolumeEating #HighFiber #VeganFood","https://www.daily-life-hacks.com/fiber-in-stir-fry-vegetables","https://www.daily-life-hacks.com/images/pins/high-fiber-stir-fry-vegetables_v3.jpg","Fiber in Stir Fry Vegetables","","High Fiber Stir Fry Vegetables - dynamic cooking action shot for natural nutrition","","High Fiber Recipes","","",""
"2026-03-24 09:21","Old school comfort. Hearty Split Pea Soup recipe with 16g fiber per bowl! Cheap, easy and perfect for winter. #SplitPeaSoup #BudgetMeals #HighFiberDinner #SoupSeason #HighFiber #ComfortFood #BudgetCooking #HealthyDinner","https://www.daily-life-hacks.com/high-fiber-split-pea-soup-recipe","https://www.daily-life-hacks.com/images/pins/split-pea-soup-recipe-high-fiber_v3.jpg","High Fiber Split Pea Soup Recipe","","Split Pea Soup Recipe High Fiber - appetizing bowl with colorful ingredients for natural nutrition","","High Fiber Recipes","","",""
"2026-03-24 11:04","Better than store bought! Creamy high-fiber hummus recipe with extra chickpeas and tahini. Perfect dip for veggies. #HummusRecipe #HealthyDip #HighFiberSnack #Hummus #HealthySnack #PlantBased #HighFiber #MediterraneanFood","https://www.daily-life-hacks.com/best-high-fiber-hummus-recipe-homemade","https://www.daily-life-hacks.com/images/pins/high-fiber-hummus-recipe-homemade_v4.jpg","Best High Fiber Hummus Recipe Homemade","","High Fiber Hummus Recipe Homemade - professionally plated meal with fresh vegetables, chickpeas for healthy snacking","","High Fiber Recipes","","",""
"2026-03-24 12:52","Don't throw away that sad spinach! Find out exactly how to revive wilted lettuce and greens with one simple, practically magical kitchen hack.

#MealPrep #KitchenTips #HealthyEating #FoodStorage #BudgetMeals #MealPrepSunday #CleanEating #HealthyLifestyle","https://www.daily-life-hacks.com/can-you-revive-wilted-lettuce","https://www.daily-life-hacks.com/images/pins/how-to-revive-wilted-lettuce-and-greens_v4.jpg","Can You Revive Wilted Lettuce","","Can You Revive Wilted Lettuce - healthy tips tips","","Healthy Meal Prep & Kitchen Tips","","",""
"2026-03-24 15:44","A simple 30-day high-fiber meal plan with easy recipes, grocery ideas, and practical daily habits you can actually keep up with. #HighFiberMeals #MealPlanIdeas #GutFriendlyFoods #EasyRecipes #HealthyHabits #WeeklyPrep #SimpleNutrition #DailyRoutine","https://www.daily-life-hacks.com/30-day-high-fiber-challenge-meal-plan","https://www.daily-life-hacks.com/images/pins/30-day-high-fiber-challenge-meal-plan_v1.jpg","30 Day High Fiber Challenge Meal Plan","","Weekly meal planner surrounded by fresh produce, simple recipes, and notes for easy high-fiber meals","","Gut Health & Nutrition Tips","","",""
"2026-03-24 16:29","Sweet and Savory. Pear, Walnut and Blue Cheese salad. Pears are one of the highest fiber fruits! #PearSalad #HealthyDinner #HighFiberRecipes #SaladRecipe #HighFiberFruit #HealthyEating #GourmetSalad #GutHealth","https://www.daily-life-hacks.com/pear-salad-with-walnuts-fiber-rich","https://www.daily-life-hacks.com/images/pins/pear-salad-with-walnuts-fiber-rich_v4.jpg","Pear Salad with Walnuts Fiber Rich","","Pear Salad with Walnuts Fiber Rich - professionally plated meal for natural nutrition","","High Fiber Recipes","","",""
"2026-03-25 09:59","Exhausted by weeknight cooking? Master the Sunday system with this ridiculously straightforward batch cooking for beginners weekly guide.

#MealPrep #KitchenTips #HealthyEating #FoodStorage #BudgetMeals #MealPrepSunday #CleanEating #HealthyLifestyle","https://www.daily-life-hacks.com/batch-cooking-for-beginners-weekly-guide","https://www.daily-life-hacks.com/images/pins/batch-cooking-for-beginners-weekly-guide_v1.jpg","Batch Cooking for Beginners Weekly Guide","","Batch Cooking for Beginners Weekly Guide - healthy tips tips","","Healthy Meal Prep & Kitchen Tips","","",""
"2026-03-25 11:39","Warm peppermint and ginger tea with a fresh, cozy flavor. A simple after-dinner drink that fits beautifully into a calm evening routine. #HerbalTea #PeppermintTea #GingerTea #WarmDrink #TeaRecipe #HealthyHabits #AfterDinnerTea #CozyKitchen","https://www.daily-life-hacks.com/gut-health-tea-peppermint-ginger-guide","https://www.daily-life-hacks.com/images/pins/gut-health-tea-peppermint-ginger_v2.jpg","Gut Health Tea Peppermint Ginger Guide","","Gut Health Tea Peppermint Ginger - warm herbal tea with ginger and mint in a simple glass mug","","Gut Health & Nutrition Tips","","",""
"2026-03-25 12:49","Stop letting your produce rot. Discover how to store fruits and vegetables properly to double their lifespan and completely eliminate food waste.

#MealPrep #KitchenTips #HealthyEating #FoodStorage #BudgetMeals #MealPrepSunday #CleanEating #HealthyLifestyle","https://www.daily-life-hacks.com/how-should-fruits-and-vegetables-be-stored","https://www.daily-life-hacks.com/images/pins/how-to-store-fruits-and-vegetables-properly_v4.jpg","How Should Fruits and Vegetables Be Stored","","How Should Fruits and Vegetables Be Stored - healthy tips tips","","Healthy Meal Prep & Kitchen Tips","","",""
"2026-03-25 15:17","Don't throw away that sad spinach! Find out exactly how to revive wilted lettuce and greens with one simple, practically magical kitchen hack.

#MealPrep #KitchenTips #HealthyEating #FoodStorage #BudgetMeals #MealPrepSunday #CleanEating #HealthyLifestyle","https://www.daily-life-hacks.com/how-to-revive-wilted-greens","https://www.daily-life-hacks.com/images/pins/how-to-revive-wilted-lettuce-and-greens_v1.jpg","How to Revive Wilted Greens","","How to Revive Wilted Greens - healthy tips tips","","Healthy Meal Prep & Kitchen Tips","","",""
"2026-03-25 16:43","Dinner in 10 mins. High Fiber Veggie Stir-Fry with broccoli, snap peas and peppers. Low calorie volume eating. #StirFry #VeggieDinner #HighFiber #StirFry #HealthyDinner #VolumeEating #HighFiber #VeganFood","https://www.daily-life-hacks.com/what-veggies-are-good-for-a-stir-fry","https://www.daily-life-hacks.com/images/pins/high-fiber-stir-fry-vegetables_v1.jpg","What Veggies Are Good for a Stir Fry","","High Fiber Stir Fry Vegetables - dynamic cooking action shot for natural nutrition","","High Fiber Recipes","","",""
"2026-03-26 09:32","Buying good bread shouldn't mean rushing to eat it in two days. Here is how to keep bread fresh longer without mold taking over your loaf.

#MealPrep #KitchenTips #HealthyEating #FoodStorage #BudgetMeals #MealPrepSunday #CleanEating #HealthyLifestyle","https://www.daily-life-hacks.com/how-to-keep-bread-fresh-longer-without-mold-tips","https://www.daily-life-hacks.com/images/pins/how-to-keep-bread-fresh-longer-without-mold_v2.jpg","How to Keep Bread Fresh Longer Without Mold Tips","","How to Keep Bread Fresh Longer Without Mold Tips - healthy tips tips","","Healthy Meal Prep & Kitchen Tips","","",""
"2026-03-26 11:11","Fresh parsley, bulgur, cucumber, and lemon make this tabbouleh feel bright, hearty, and easy to prep ahead. #Tabbouleh #MediterraneanFood #HighFiberLunch #HealthyLunch #BulgurSalad #MealPrep #FreshRecipes #VeganRecipes","https://www.daily-life-hacks.com/tabbouleh-salad-high-fiber-bulgur-tips","https://www.daily-life-hacks.com/images/pins/tabbouleh-salad-high-fiber-bulgur_v1.jpg","Tabbouleh Salad High Fiber Bulgur Tips","","Tabbouleh Salad High Fiber Bulgur - fresh parsley salad with bulgur, tomatoes, and cucumber for a bright Mediterranean lunch","","High Fiber Recipes","","",""
"2026-03-26 13:50","Stop throwing away overripe bananas. Learn exactly how to freeze bananas for smoothies so they blend perfectly without ruining your blender.

#MealPrep #KitchenTips #HealthyEating #FoodStorage #BudgetMeals #MealPrepSunday #CleanEating #HealthyLifestyle","https://www.daily-life-hacks.com/how-to-freeze-bananas-for-smoothies-later","https://www.daily-life-hacks.com/images/pins/how-to-freeze-bananas-for-smoothies_v4.jpg","How to Freeze Bananas for Smoothies Later","","How to Freeze Bananas for Smoothies Later - healthy tips tips","","Healthy Meal Prep & Kitchen Tips","","",""
"2026-03-26 15:39","Popcorn is a whole grain! Healthy high-fiber popcorn toppings: Nutritional yeast, chili lime and cinnamon. Ditch the butter. #HealthyPopcorn #SnackHacks #HighFiber #Popcorn #HealthySnacks #HighFiber #MovieNightSnack #WholeGrain","https://www.daily-life-hacks.com/best-high-fiber-popcorn-toppings-healthy","https://www.daily-life-hacks.com/images/pins/high-fiber-popcorn-toppings-healthy_v2.jpg","Best High Fiber Popcorn Toppings Healthy","","High Fiber Popcorn Toppings Healthy - appetizing bowl with colorful ingredients for healthy snacking","","High Fiber Recipes","","",""
"2026-03-26 17:33","Cooking for one doesn't have to be expensive or exhausting. Learn how to meal prep on a budget for one person and save your sanity weeknights.

#MealPrep #KitchenTips #HealthyEating #FoodStorage #BudgetMeals #MealPrepSunday #CleanEating #HealthyLifestyle","https://www.daily-life-hacks.com/how-to-meal-plan-on-a-budget","https://www.daily-life-hacks.com/images/pins/how-to-meal-prep-on-a-budget-for-one-person_v2.jpg","How to Meal Plan on a Budget","","How to Meal Plan on a Budget - healthy tips tips","","Healthy Meal Prep & Kitchen Tips","","",""
"2026-03-27 10:07","Fiber works best when your hydration habits keep up. This simple guide breaks down the water and fiber balance that helps meals feel more comfortable day to day. #Hydration #FiberTips #GutHealth #HealthyHabits #NutritionTips #DailyWellness #BalancedEating #SimpleHealth","https://www.daily-life-hacks.com/water-and-fiber-the-golden-rule-tips","https://www.daily-life-hacks.com/images/pins/water-and-fiber-the-golden-rule_v3.jpg","Water and Fiber the Golden Rule Tips","","Water and Fiber The Golden Rule - simple hydration and fiber foods arranged for an everyday wellness guide","","Gut Health & Nutrition Tips","","",""
"2026-03-27 11:59","Never get bored! 4 Chia Pudding flavors: Chocolate, Berry, Mango and Vanilla. High fiber meal prep breakfast. #ChiaPudding #BreakfastIdeas #HighFiber #ChiaSeeds #HealthyBreakfast #MealPrep #HighFiber #GutHealth","https://www.daily-life-hacks.com/how-much-chia-pudding-for-breakfast","https://www.daily-life-hacks.com/images/pins/chia-pudding-variations-for-breakfast_v3.jpg","How Much Chia Pudding for Breakfast","","Chia Pudding Variations for Breakfast - overhead view of prepared meal with chia seeds for a healthy morning","","High Fiber Recipes","","",""
"2026-03-27 13:12","Stop throwing money in the trash. Discover how to reduce food waste at home with easy tips that actually fit into your busy schedule.

#MealPrep #KitchenTips #HealthyEating #FoodStorage #BudgetMeals #MealPrepSunday #CleanEating #HealthyLifestyle","https://www.daily-life-hacks.com/how-to-reduce-food-waste-at-home-easy-tips","https://www.daily-life-hacks.com/images/pins/how-to-reduce-food-waste-at-home-easy-tips_v1.jpg","How to Reduce Food Waste At Home Easy Tips","","How to Reduce Food Waste At Home Easy Tips - healthy tips tips","","Healthy Meal Prep & Kitchen Tips","","",""
"2026-03-27 14:33","Tired of cooking in chaos? Learn exactly how to organize a small kitchen on a budget with these simple storage hacks.

#MealPrep #KitchenTips #HealthyEating #FoodStorage #BudgetMeals #MealPrepSunday #CleanEating #HealthyLifestyle","https://www.daily-life-hacks.com/how-to-organize-small-kitchen-ideas-on-a-budget","https://www.daily-life-hacks.com/images/pins/how-to-organize-a-small-kitchen-on-a-budget_v1.jpg","How to Organize Small Kitchen Ideas on a Budget","","How to Organize Small Kitchen Ideas on a Budget - healthy tips tips","","Healthy Meal Prep & Kitchen Tips","","",""
"2026-03-27 16:58","Pizza night is back! Crispy cauliflower pizza crust recipe. High fiber, gluten-free and low calorie. #CauliflowerPizza #HealthyPizza #HighFiberDinner #HealthyPizza #CauliflowerCrust #HighFiber #GuiltFree #DinnerIdeas","https://www.daily-life-hacks.com/best-high-fiber-pizza-crust-cauliflower","https://www.daily-life-hacks.com/images/pins/high-fiber-pizza-crust-cauliflower_v4.jpg","Best High Fiber Pizza Crust Cauliflower","","High Fiber Pizza Crust Cauliflower - appetizing food presentation for natural nutrition","","High Fiber Recipes","","",""
"2026-03-28 09:30","Popcorn is a whole grain! Healthy high-fiber popcorn toppings: Nutritional yeast, chili lime and cinnamon. Ditch the butter. #HealthyPopcorn #SnackHacks #HighFiber #Popcorn #HealthySnacks #HighFiber #MovieNightSnack #WholeGrain","https://www.daily-life-hacks.com/high-fiber-popcorn-toppings-healthy","https://www.daily-life-hacks.com/images/pins/high-fiber-popcorn-toppings-healthy_v1.jpg","High Fiber Popcorn Toppings Healthy","","High Fiber Popcorn Toppings Healthy - appetizing bowl with colorful ingredients for healthy snacking","","High Fiber Recipes","","",""
"2026-03-28 11:08","Fiber works best when your hydration habits keep up. This simple guide breaks down the water and fiber balance that helps meals feel more comfortable day to day. #Hydration #FiberTips #GutHealth #HealthyHabits #NutritionTips #DailyWellness #BalancedEating #SimpleHealth","https://www.daily-life-hacks.com/water-and-fiber-the-golden-rule-guide","https://www.daily-life-hacks.com/images/pins/water-and-fiber-the-golden-rule_v2.jpg","Water and Fiber the Golden Rule Guide","","Water and Fiber The Golden Rule - simple hydration and fiber foods arranged for an everyday wellness guide","","Gut Health & Nutrition Tips","","",""
"2026-03-28 13:50","Buying good bread shouldn't mean rushing to eat it in two days. Here is how to keep bread fresh longer without mold taking over your loaf.

#MealPrep #KitchenTips #HealthyEating #FoodStorage #BudgetMeals #MealPrepSunday #CleanEating #HealthyLifestyle","https://www.daily-life-hacks.com/how-to-keep-bread-fresh-longer-without-mold","https://www.daily-life-hacks.com/images/pins/how-to-keep-bread-fresh-longer-without-mold_v1.jpg","How to Keep Bread Fresh Longer Without Mold","","How to Keep Bread Fresh Longer Without Mold - healthy tips tips","","Healthy Meal Prep & Kitchen Tips","","",""
"2026-03-28 14:35","Inflation making the checkout line painful? Learn how to make grocery shopping cheaper with these incredibly effective, psychology-based strategies.

#MealPrep #KitchenTips #HealthyEating #FoodStorage #BudgetMeals #MealPrepSunday #CleanEating #HealthyLifestyle","https://www.daily-life-hacks.com/how-to-get-groceries-cheaper","https://www.daily-life-hacks.com/images/pins/how-to-make-grocery-shopping-cheaper_v3.jpg","How to Get Groceries Cheaper","","How to Get Groceries Cheaper - healthy tips tips","","Healthy Meal Prep & Kitchen Tips","","",""
