"Date - Intl. format or prompt","Text","Link(s) - Separated by comma for FB carousels","Media URL(s) - Separated by comma","Title - For the video, pin, PDF ..","Label(s) - Separated by comma","Alt text(s) - Separated by ||","Comment(s) - Separated by ||","Pin board, FB album, or Google category","Post subtype - I.e. story, reel, PDF ..","CTA - For Facebook links or Google","Reminder - For stories, reels, shorts, and TikToks"
"2026-03-12 10:01","Steamed artichoke with lemon and garlic is one of those simple dishes that feels fresh, satisfying, and a little special. #ArtichokeRecipes #GutFriendlyMeals #HighFiberVeggies #VegetarianDinner #MediterraneanFood #FiberRich #SimpleCooking #FreshIngredients","https://www.daily-life-hacks.com/are-artichokes-good-for-digestion","https://www.daily-life-hacks.com/images/pins/artichoke-recipes-for-gut-health_v2.jpg","Are Artichokes Good for Digestion","","Artichoke Recipes for Gut Health - steamed artichoke with lemon and garlic on a fresh dinner plate","","High Fiber Recipes","","",""
"2026-03-12 11:56","Fresh parsley, bulgur, cucumber, and lemon make this tabbouleh feel bright, hearty, and easy to prep ahead. #Tabbouleh #MediterraneanFood #HighFiberLunch #HealthyLunch #BulgurSalad #MealPrep #FreshRecipes #VeganRecipes","https://www.daily-life-hacks.com/best-tabbouleh-salad-high-fiber-bulgur","https://www.daily-life-hacks.com/images/pins/tabbouleh-salad-high-fiber-bulgur_v2.jpg","Best Tabbouleh Salad High Fiber Bulgur","","Tabbouleh Salad High Fiber Bulgur - fresh parsley salad with bulgur, tomatoes, and cucumber for a bright Mediterranean lunch","","High Fiber Recipes","","",""
"2026-03-12 13:28","Sick of your expensive avocados turning brown immediately? Discover the best way to store avocados to stop browning and save your guacamole.

#MealPrep #KitchenTips #HealthyEating #FoodStorage #BudgetMeals #MealPrepSunday #CleanEating #HealthyLifestyle","https://www.daily-life-hacks.com/how-to-store-avocados-to-keep-them-fresh","https://www.daily-life-hacks.com/images/pins/best-way-to-store-avocados-to-stop-browning_v1.jpg","How to Store Avocados to Keep Them Fresh","","How to Store Avocados to Keep Them Fresh - healthy tips tips","","Healthy Meal Prep & Kitchen Tips","","",""
"2026-03-12 15:30","Warm peppermint and ginger tea with a fresh, cozy flavor. A simple after-dinner drink that fits beautifully into a calm evening routine. #HerbalTea #PeppermintTea #GingerTea #WarmDrink #TeaRecipe #HealthyHabits #AfterDinnerTea #CozyKitchen","https://www.daily-life-hacks.com/gut-health-tea-peppermint-ginger-tips","https://www.daily-life-hacks.com/images/pins/gut-health-tea-peppermint-ginger_v3.jpg","Gut Health Tea Peppermint Ginger Tips","","Gut Health Tea Peppermint Ginger - warm herbal tea with ginger and mint in a simple glass mug","","Gut Health & Nutrition Tips","","",""
"2026-03-12 16:18","Eating well doesn't have to cost a fortune. Grab this exact grocery shopping list for healthy eating on a budget and start saving immediately.

#MealPrep #KitchenTips #HealthyEating #FoodStorage #BudgetMeals #MealPrepSunday #CleanEating #HealthyLifestyle","https://www.daily-life-hacks.com/best-grocery-shopping-list-for-healthy-eating-on-a-budget","https://www.daily-life-hacks.com/images/pins/grocery-shopping-list-for-healthy-eating-on-a-budget_v4.jpg","Best Grocery Shopping List for Healthy Eating on a Budget","","Best Grocery Shopping List for Healthy Eating on a Budget - healthy tips tips","","Healthy Meal Prep & Kitchen Tips","","",""
"2026-03-13 10:18","Don't ruin your salad with sugar! DIY Tahini and Lemon dressing recipes packed with fiber and healthy fats. #SaladDressing #HealthySauce #TahiniRecipe #HealthyDressing #Tahini #HighFiber #SaladInspo #CleanEating","https://www.daily-life-hacks.com/high-fiber-salad-dressings-homemade-guide","https://www.daily-life-hacks.com/images/pins/high-fiber-salad-dressings-homemade_v2.jpg","High Fiber Salad Dressings Homemade Guide","","High Fiber Salad Dressings Homemade - fresh meal in glass containers for natural nutrition","","High Fiber Recipes","","",""
"2026-03-13 10:58","Don't throw away that sad spinach! Find out exactly how to revive wilted lettuce and greens with one simple, practically magical kitchen hack.

#MealPrep #KitchenTips #HealthyEating #FoodStorage #BudgetMeals #MealPrepSunday #CleanEating #HealthyLifestyle","https://www.daily-life-hacks.com/how-do-you-bring-wilted-lettuce-back-to-life","https://www.daily-life-hacks.com/images/pins/how-to-revive-wilted-lettuce-and-greens_v2.jpg","How Do You Bring Wilted Lettuce Back to Life","","How Do You Bring Wilted Lettuce Back to Life - healthy tips tips","","Healthy Meal Prep & Kitchen Tips","","",""
"2026-03-13 13:11","High-protein, high-fiber meals with beans, chicken, lentils, vegetables, and grains can make dinner feel more balanced and satisfying. #HighProteinHighFiber #BalancedMeals #EasyDinner #MealIdeas #FiberRich #ProteinPacked #SimpleCooking #WeeknightMeals","https://www.daily-life-hacks.com/easy-high-protein-high-fiber-meals","https://www.daily-life-hacks.com/images/pins/high-protein-high-fiber-meals-for-weight-loss_v4.jpg","Easy High Protein High Fiber Meals","","Balanced plate with lentils, vegetables, grains, and protein arranged for a hearty everyday meal","","High Fiber Recipes","","",""
"2026-03-13 14:37","Tired of your cilantro turning into green slime? Here is exactly how to store fresh herbs to last longer and save money.

#MealPrep #KitchenTips #HealthyEating #FoodStorage #BudgetMeals #MealPrepSunday #CleanEating #HealthyLifestyle","https://www.daily-life-hacks.com/how-to-store-fresh-herbs-for-long-time","https://www.daily-life-hacks.com/images/pins/how-to-store-fresh-herbs-to-last-longer_v1.jpg","How to Store Fresh Herbs for Long Time","","How to Store Fresh Herbs for Long Time - healthy tips tips","","Healthy Meal Prep & Kitchen Tips","","",""
"2026-03-13 16:36","Eating well doesn't have to cost a fortune. Grab this exact grocery shopping list for healthy eating on a budget and start saving immediately.

#MealPrep #KitchenTips #HealthyEating #FoodStorage #BudgetMeals #MealPrepSunday #CleanEating #HealthyLifestyle","https://www.daily-life-hacks.com/grocery-shopping-list-for-healthy-eating-on-a-budget","https://www.daily-life-hacks.com/images/pins/grocery-shopping-list-for-healthy-eating-on-a-budget_v1.jpg","Grocery Shopping List for Healthy Eating on a Budget","","Grocery Shopping List for Healthy Eating on a Budget - healthy tips tips","","Healthy Meal Prep & Kitchen Tips","","",""
"2026-03-14 10:03","Exhausted by weeknight cooking? Master the Sunday system with this ridiculously straightforward batch cooking for beginners weekly guide.

#MealPrep #KitchenTips #HealthyEating #FoodStorage #BudgetMeals #MealPrepSunday #CleanEating #HealthyLifestyle","https://www.daily-life-hacks.com/best-batch-cooking-for-beginners-weekly-guide","https://www.daily-life-hacks.com/images/pins/batch-cooking-for-beginners-weekly-guide_v4.jpg","Best Batch Cooking for Beginners Weekly Guide","","Best Batch Cooking for Beginners Weekly Guide - healthy tips tips","","Healthy Meal Prep & Kitchen Tips","","",""
"2026-03-14 11:53","Oatmeal vs. grits is one of those breakfast comparisons that gets easier once you see the fiber difference side by side. #OatmealVsGrits #FiberComparison #HealthyBreakfast #BreakfastIdeas #WholeGrains #NutritionTips #SimpleChoices #MorningMeals","https://www.daily-life-hacks.com/best-oatmeal-vs-grits-fiber-content","https://www.daily-life-hacks.com/images/pins/oatmeal-vs-grits-fiber-content_v3.jpg","Best Oatmeal Vs Grits Fiber Content","","Two breakfast bowls side by side with oatmeal toppings and warm grits for an easy fiber comparison","","Gut Health & Nutrition Tips","","",""
"2026-03-14 12:55","Soft bran muffins with raisins, honey, and a cozy bakery feel. A practical make-ahead breakfast when you want more fiber without giving up flavor. #BranMuffins #HealthyBaking #BreakfastIdeas #HighFiber #MealPrepBreakfast #HomeBaking #EasyRecipes #CozyFood","https://www.daily-life-hacks.com/high-fiber-bran-muffins-that-taste-good","https://www.daily-life-hacks.com/images/pins/high-fiber-bran-muffins-that-taste-good_v1.jpg","High Fiber Bran Muffins That Taste Good","","High Fiber Bran Muffins That Taste Good - golden bran muffins with raisins on a simple breakfast tray","","High Fiber Recipes","","",""
"2026-03-14 15:28","Cooking for one doesn't have to be expensive or exhausting. Learn how to meal prep on a budget for one person and save your sanity weeknights.

#MealPrep #KitchenTips #HealthyEating #FoodStorage #BudgetMeals #MealPrepSunday #CleanEating #HealthyLifestyle","https://www.daily-life-hacks.com/how-to-meal-prep-on-a-budget","https://www.daily-life-hacks.com/images/pins/how-to-meal-prep-on-a-budget-for-one-person_v1.jpg","How to Meal Prep on a Budget","","How to Meal Prep on a Budget - healthy tips tips","","Healthy Meal Prep & Kitchen Tips","","",""
"2026-03-14 16:10","Kickstart your morning with these simple, gut-loving high-fiber breakfasts. Chia pudding, overnight oats and veggie smoothies to keep you full and support microbiome health all day! Perfect for busy lifestyles. #HighFiberBreakfast #GutFriendly #HealthyStart #HighFiberBreakfast #GutHealth #EasyRecipes #HealthyBreakfastIdeas #FiberRich","https://www.daily-life-hacks.com/easy-high-fiber-breakfast-ideas-for-gut-health","https://www.daily-life-hacks.com/images/pins/easy-high-fiber-breakfast-ideas-for-gut-health_v1.jpg","Easy High Fiber Breakfast Ideas for Gut Health","","Easy High Fiber Breakfast Ideas for Gut Health - beautiful breakfast bowls with fresh toppings with oats, chia seeds for a healthy morning","","High Fiber Recipes","","",""
"2026-03-15 09:14","Oatmeal vs. grits is one of those breakfast comparisons that gets easier once you see the fiber difference side by side. #OatmealVsGrits #FiberComparison #HealthyBreakfast #BreakfastIdeas #WholeGrains #NutritionTips #SimpleChoices #MorningMeals","https://www.daily-life-hacks.com/oatmeal-vs-grits-fiber-content-guide","https://www.daily-life-hacks.com/images/pins/oatmeal-vs-grits-fiber-content_v2.jpg","Oatmeal Vs Grits Fiber Content Guide","","Two breakfast bowls side by side with oatmeal toppings and warm grits for an easy fiber comparison","","Gut Health & Nutrition Tips","","",""
"2026-03-15 11:06","Layer your way to health! Greek yogurt, high-fiber granola and mixed berries parfait. 15g of fiber to start your day. #YogurtParfait #HealthyBreakfast #GutHealth #ParfaitRecipe #HighFiber #BreakfastGoals #GutFriendly #HealthyStart","https://www.daily-life-hacks.com/high-fiber-yogurt-parfait-for-breakfast","https://www.daily-life-hacks.com/images/pins/high-fiber-yogurt-parfait-for-breakfast_v1.jpg","High Fiber Yogurt Parfait for Breakfast","","High Fiber Yogurt Parfait for Breakfast - fresh meal in glass containers with berries, yogurt for a healthy morning","","High Fiber Recipes","","",""
"2026-03-15 12:34","Cooking for one doesn't have to be expensive or exhausting. Learn how to meal prep on a budget for one person and save your sanity weeknights.

#MealPrep #KitchenTips #HealthyEating #FoodStorage #BudgetMeals #MealPrepSunday #CleanEating #HealthyLifestyle","https://www.daily-life-hacks.com/how-to-meal-prep-at-trader-joes-on-a-budget-for-one-person","https://www.daily-life-hacks.com/images/pins/how-to-meal-prep-on-a-budget-for-one-person_v3.jpg","How to Meal Prep At Trader Joe's on a Budget for One Person","","How to Meal Prep At Trader Joe's on a Budget for One Person - healthy tips tips","","Healthy Meal Prep & Kitchen Tips","","",""
"2026-03-15 14:39","Stuck at a drive-thru? This guide rounds up practical high-fiber fast food picks from places like Subway, Chipotle, and Starbucks for busier days. #FastFoodHacks #HealthyOnTheGo #HighFiber #QuickMeals #NutritionTips #EatingOut #SimpleChoices #BusyDays","https://www.daily-life-hacks.com/best-high-fiber-fast-food-options-guide","https://www.daily-life-hacks.com/images/pins/high-fiber-fast-food-options-guide_v3.jpg","Best High Fiber Fast Food Options Guide","","Takeout-style meal with beans, grains, vegetables, and toppings arranged on a tray for a quick comparison guide","","Gut Health & Nutrition Tips","","",""
"2026-03-15 16:36","Old school comfort. Hearty Split Pea Soup recipe with 16g fiber per bowl! Cheap, easy and perfect for winter. #SplitPeaSoup #BudgetMeals #HighFiberDinner #SoupSeason #HighFiber #ComfortFood #BudgetCooking #HealthyDinner","https://www.daily-life-hacks.com/how-much-fiber-in-a-cup-of-split-pea-soup","https://www.daily-life-hacks.com/images/pins/split-pea-soup-recipe-high-fiber_v1.jpg","How Much Fiber in a Cup of Split Pea Soup","","Split Pea Soup Recipe High Fiber - appetizing bowl with colorful ingredients for natural nutrition","","High Fiber Recipes","","",""
"2026-03-16 09:24","Stop throwing money in the trash. Discover how to reduce food waste at home with easy tips that actually fit into your busy schedule.

#MealPrep #KitchenTips #HealthyEating #FoodStorage #BudgetMeals #MealPrepSunday #CleanEating #HealthyLifestyle","https://www.daily-life-hacks.com/best-how-to-reduce-food-waste-at-home-easy-tips","https://www.daily-life-hacks.com/images/pins/how-to-reduce-food-waste-at-home-easy-tips_v4.jpg","Best How to Reduce Food Waste At Home Easy Tips","","Best How to Reduce Food Waste At Home Easy Tips - healthy tips tips","","Healthy Meal Prep & Kitchen Tips","","",""
"2026-03-16 11:27","Sweet and Savory. Pear, Walnut and Blue Cheese salad. Pears are one of the highest fiber fruits! #PearSalad #HealthyDinner #HighFiberRecipes #SaladRecipe #HighFiberFruit #HealthyEating #GourmetSalad #GutHealth","https://www.daily-life-hacks.com/best-pear-salad-with-walnuts-fiber-rich","https://www.daily-life-hacks.com/images/pins/pear-salad-with-walnuts-fiber-rich_v3.jpg","Best Pear Salad with Walnuts Fiber Rich","","Pear Salad with Walnuts Fiber Rich - professionally plated meal for natural nutrition","","High Fiber Recipes","","",""
"2026-03-16 13:30","Kickstart your morning with these simple, gut-loving high-fiber breakfasts. Chia pudding, overnight oats and veggie smoothies to keep you full and support microbiome health all day! Perfect for busy lifestyles. #HighFiberBreakfast #GutFriendly #HealthyStart #HighFiberBreakfast #GutHealth #EasyRecipes #HealthyBreakfastIdeas #FiberRich","https://www.daily-life-hacks.com/easy-high-fiber-breakfast-ideas-for-gut-health-tips","https://www.daily-life-hacks.com/images/pins/easy-high-fiber-breakfast-ideas-for-gut-health_v3.jpg","Easy High Fiber Breakfast Ideas for Gut Health Tips","","Easy High Fiber Breakfast Ideas for Gut Health - beautiful breakfast bowls with fresh toppings with oats, chia seeds for a healthy morning","","High Fiber Recipes","","",""
"2026-03-16 14:34","Oatmeal vs. grits is one of those breakfast comparisons that gets easier once you see the fiber difference side by side. #OatmealVsGrits #FiberComparison #HealthyBreakfast #BreakfastIdeas #WholeGrains #NutritionTips #SimpleChoices #MorningMeals","https://www.daily-life-hacks.com/oatmeal-vs-grits-fiber-content-tips","https://www.daily-life-hacks.com/images/pins/oatmeal-vs-grits-fiber-content_v4.jpg","Oatmeal Vs Grits Fiber Content Tips","","Two breakfast bowls side by side with oatmeal toppings and warm grits for an easy fiber comparison","","Gut Health & Nutrition Tips","","",""
"2026-03-16 17:22","Whole wheat pasta and white pasta can look similar on the plate, but the fiber difference changes how filling the meal feels. #WholeWheat #PastaComparison #HighFiber #HealthySwaps #WholeGrains #EasyMeals #NutritionTips #SimpleChoices","https://www.daily-life-hacks.com/whole-wheat-vs-white-pasta-nutrition","https://www.daily-life-hacks.com/images/pins/whole-wheat-vs-white-pasta-fiber_v1.jpg","Whole Wheat Vs White Pasta Nutrition","","Cooked whole wheat pasta and white pasta plated side by side for a simple fiber comparison","","Gut Health & Nutrition Tips","","",""
"2026-03-17 09:50","Cooking for one doesn't have to be expensive or exhausting. Learn how to meal prep on a budget for one person and save your sanity weeknights.

#MealPrep #KitchenTips #HealthyEating #FoodStorage #BudgetMeals #MealPrepSunday #CleanEating #HealthyLifestyle","https://www.daily-life-hacks.com/how-to-meal-prep-on-a-budget-for-one-person-guide","https://www.daily-life-hacks.com/images/pins/how-to-meal-prep-on-a-budget-for-one-person_v4.jpg","Cooking Solo: How to Meal Prep on a Budget for One Person","","Cooking Solo: How to Meal Prep on a Budget for One Person - healthy tips tips","","Healthy Meal Prep & Kitchen Tips","","",""
"2026-03-17 10:59","Stop letting your produce rot. Discover how to store fruits and vegetables properly to double their lifespan and completely eliminate food waste.

#MealPrep #KitchenTips #HealthyEating #FoodStorage #BudgetMeals #MealPrepSunday #CleanEating #HealthyLifestyle","https://www.daily-life-hacks.com/how-to-store-fruits-and-vegetables","https://www.daily-life-hacks.com/images/pins/how-to-store-fruits-and-vegetables-properly_v1.jpg","How to Store Fruits and Vegetables","","How to Store Fruits and Vegetables - healthy tips tips","","Healthy Meal Prep & Kitchen Tips","","",""
"2026-03-17 12:52","Inflation making the checkout line painful? Learn how to make grocery shopping cheaper with these incredibly effective, psychology-based strategies.

#MealPrep #KitchenTips #HealthyEating #FoodStorage #BudgetMeals #MealPrepSunday #CleanEating #HealthyLifestyle","https://www.daily-life-hacks.com/how-to-make-groceries-cheaper","https://www.daily-life-hacks.com/images/pins/how-to-make-grocery-shopping-cheaper_v4.jpg","How to Make Groceries Cheaper","","How to Make Groceries Cheaper - healthy tips tips","","Healthy Meal Prep & Kitchen Tips","","",""
"2026-03-17 14:20","Eating well doesn't have to cost a fortune. Grab this exact grocery shopping list for healthy eating on a budget and start saving immediately.

#MealPrep #KitchenTips #HealthyEating #FoodStorage #BudgetMeals #MealPrepSunday #CleanEating #HealthyLifestyle","https://www.daily-life-hacks.com/grocery-shopping-list-for-healthy-eating-on-a-budget-tips","https://www.daily-life-hacks.com/images/pins/grocery-shopping-list-for-healthy-eating-on-a-budget_v3.jpg","Grocery Shopping List for Healthy Eating on a Budget Tips","","Grocery Shopping List for Healthy Eating on a Budget Tips - healthy tips tips","","Healthy Meal Prep & Kitchen Tips","","",""
"2026-03-17 17:28","Feeling overwhelmed by the kitchen? Start here with these totally manageable freezer meal prep ideas for beginners and save your weeknights.

#MealPrep #KitchenTips #HealthyEating #FoodStorage #BudgetMeals #MealPrepSunday #CleanEating #HealthyLifestyle","https://www.daily-life-hacks.com/freezer-meal-prep-ideas-for-beginners-guide","https://www.daily-life-hacks.com/images/pins/freezer-meal-prep-ideas-for-beginners_v4.jpg","Fill Your Stash: Freezer Meal Prep Ideas for Beginners","","Fill Your Stash: Freezer Meal Prep Ideas for Beginners - healthy tips tips","","Healthy Meal Prep & Kitchen Tips","","",""
"2026-03-18 09:18","Kickstart your morning with these simple, gut-loving high-fiber breakfasts. Chia pudding, overnight oats and veggie smoothies to keep you full and support microbiome health all day! Perfect for busy lifestyles. #HighFiberBreakfast #GutFriendly #HealthyStart #HighFiberBreakfast #GutHealth #EasyRecipes #HealthyBreakfastIdeas #FiberRich","https://www.daily-life-hacks.com/best-easy-high-fiber-breakfast-ideas-for-gut-health","https://www.daily-life-hacks.com/images/pins/easy-high-fiber-breakfast-ideas-for-gut-health_v4.jpg","Best Easy High Fiber Breakfast Ideas for Gut Health","","Easy High Fiber Breakfast Ideas for Gut Health - beautiful breakfast bowls with fresh toppings with oats, chia seeds for a healthy morning","","High Fiber Recipes","","",""
"2026-03-18 10:49","Dinner in 10 mins. High Fiber Veggie Stir-Fry with broccoli, snap peas and peppers. Low calorie volume eating. #StirFry #VeggieDinner #HighFiber #StirFry #HealthyDinner #VolumeEating #HighFiber #VeganFood","https://www.daily-life-hacks.com/what-vegetables-can-you-add-to-a-stir-fry","https://www.daily-life-hacks.com/images/pins/high-fiber-stir-fry-vegetables_v2.jpg","What Vegetables Can You Add to a Stir Fry","","High Fiber Stir Fry Vegetables - dynamic cooking action shot for natural nutrition","","High Fiber Recipes","","",""
"2026-03-18 12:58","Layer your way to health! Greek yogurt, high-fiber granola and mixed berries parfait. 15g of fiber to start your day. #YogurtParfait #HealthyBreakfast #GutHealth #ParfaitRecipe #HighFiber #BreakfastGoals #GutFriendly #HealthyStart","https://www.daily-life-hacks.com/high-fiber-yogurt-parfait-for-breakfast-tips","https://www.daily-life-hacks.com/images/pins/high-fiber-yogurt-parfait-for-breakfast_v3.jpg","High Fiber Yogurt Parfait for Breakfast Tips","","High Fiber Yogurt Parfait for Breakfast - fresh meal in glass containers with berries, yogurt for a healthy morning","","High Fiber Recipes","","",""
"2026-03-18 15:07","Never get bored! 4 Chia Pudding flavors: Chocolate, Berry, Mango and Vanilla. High fiber meal prep breakfast. #ChiaPudding #BreakfastIdeas #HighFiber #ChiaSeeds #HealthyBreakfast #MealPrep #HighFiber #GutHealth","https://www.daily-life-hacks.com/is-chia-seed-pudding-enough-for-breakfast","https://www.daily-life-hacks.com/images/pins/chia-pudding-variations-for-breakfast_v1.jpg","Is Chia Seed Pudding Enough for Breakfast","","Chia Pudding Variations for Breakfast - overhead view of prepared meal with chia seeds for a healthy morning","","High Fiber Recipes","","",""
"2026-03-18 17:04","Old school comfort. Hearty Split Pea Soup recipe with 16g fiber per bowl! Cheap, easy and perfect for winter. #SplitPeaSoup #BudgetMeals #HighFiberDinner #SoupSeason #HighFiber #ComfortFood #BudgetCooking #HealthyDinner","https://www.daily-life-hacks.com/is-there-a-lot-of-fiber-in-split-pea-soup","https://www.daily-life-hacks.com/images/pins/split-pea-soup-recipe-high-fiber_v4.jpg","Is There a Lot of Fiber in Split Pea Soup","","Split Pea Soup Recipe High Fiber - appetizing bowl with colorful ingredients for natural nutrition","","High Fiber Recipes","","",""
"2026-03-19 09:40","Low carb, high fiber! 5 delicious cauliflower rice recipes that taste like the real thing. Fried rice, burrito bowls and more. #CauliflowerRice #KetoRecipes #HighFiber #CauliflowerRice #LowCarb #HighFiber #KetoDinner #VeggieLoaded","https://www.daily-life-hacks.com/best-high-fiber-cauliflower-rice-recipes","https://www.daily-life-hacks.com/images/pins/high-fiber-cauliflower-rice-recipes_v3.jpg","Best High Fiber Cauliflower Rice Recipes","","High Fiber Cauliflower Rice Recipes - dynamic cooking action shot for natural nutrition","","High Fiber Recipes","","",""
"2026-03-19 11:19","Tired of cooking in chaos? Learn exactly how to organize a small kitchen on a budget with these simple storage hacks.

#MealPrep #KitchenTips #HealthyEating #FoodStorage #BudgetMeals #MealPrepSunday #CleanEating #HealthyLifestyle","https://www.daily-life-hacks.com/how-to-organize-a-small-kitchen-on-a-budget-guide","https://www.daily-life-hacks.com/images/pins/how-to-organize-a-small-kitchen-on-a-budget_v4.jpg","Maximize Your Space: How to Organize a Small Kitchen on a Budget","","Maximize Your Space: How to Organize a Small Kitchen on a Budget - healthy tips tips","","Healthy Meal Prep & Kitchen Tips","","",""
"2026-03-19 13:31","Layer your way to health! Greek yogurt, high-fiber granola and mixed berries parfait. 15g of fiber to start your day. #YogurtParfait #HealthyBreakfast #GutHealth #ParfaitRecipe #HighFiber #BreakfastGoals #GutFriendly #HealthyStart","https://www.daily-life-hacks.com/high-fiber-yogurt-parfait-for-breakfast-guide","https://www.daily-life-hacks.com/images/pins/high-fiber-yogurt-parfait-for-breakfast_v2.jpg","High Fiber Yogurt Parfait for Breakfast Guide","","High Fiber Yogurt Parfait for Breakfast - fresh meal in glass containers with berries, yogurt for a healthy morning","","High Fiber Recipes","","",""
"2026-03-19 14:57","Warm peppermint and ginger tea with a fresh, cozy flavor. A simple after-dinner drink that fits beautifully into a calm evening routine. #HerbalTea #PeppermintTea #GingerTea #WarmDrink #TeaRecipe #HealthyHabits #AfterDinnerTea #CozyKitchen","https://www.daily-life-hacks.com/best-gut-health-tea-peppermint-ginger","https://www.daily-life-hacks.com/images/pins/gut-health-tea-peppermint-ginger_v4.jpg","Best Gut Health Tea Peppermint Ginger","","Gut Health Tea Peppermint Ginger - warm herbal tea with ginger and mint in a simple glass mug","","Gut Health & Nutrition Tips","","",""
"2026-03-19 16:45","Steamed artichoke with lemon and garlic is one of those simple dishes that feels fresh, satisfying, and a little special. #ArtichokeRecipes #GutFriendlyMeals #HighFiberVeggies #VegetarianDinner #MediterraneanFood #FiberRich #SimpleCooking #FreshIngredients","https://www.daily-life-hacks.com/best-artichoke-recipes-for-gut-health","https://www.daily-life-hacks.com/images/pins/artichoke-recipes-for-gut-health_v4.jpg","Artichoke Recipes for Gut Health","","Artichoke Recipes for Gut Health - steamed artichoke with lemon and garlic on a fresh dinner plate","","High Fiber Recipes","","",""
"2026-03-20 10:00","Soft bran muffins with raisins, honey, and a cozy bakery feel. A practical make-ahead breakfast when you want more fiber without giving up flavor. #BranMuffins #HealthyBaking #BreakfastIdeas #HighFiber #MealPrepBreakfast #HomeBaking #EasyRecipes #CozyFood","https://www.daily-life-hacks.com/high-fiber-bran-muffins-that-taste-good-guide","https://www.daily-life-hacks.com/images/pins/high-fiber-bran-muffins-that-taste-good_v2.jpg","High Fiber Bran Muffins That Taste Good Guide","","High Fiber Bran Muffins That Taste Good - golden bran muffins with raisins on a simple breakfast tray","","High Fiber Recipes","","",""
