"2026-04-06 13:19","Sick of your expensive avocados turning brown immediately? Discover the best way to store avocados to stop browning and save your guacamole.

#MealPrep #KitchenTips #HealthyEating #FoodStorage #BudgetMeals #MealPrepSunday #CleanEating #HealthyLifestyle","https://www.daily-life-hacks.com/how-to-store-avocados-to-prevent-browning","https://www.daily-life-hacks.com/images/pins/best-way-to-store-avocados-to-stop-browning_v4.jpg","How to Store Avocados to Prevent Browning","","How to Store Avocados to Prevent Browning - healthy tips tips","","Healthy Meal Prep & Kitchen Tips","","",""
"2026-04-06 14:29","Inflation making the checkout line painful? Learn how to make grocery shopping cheaper with these incredibly effective, psychology-based strategies.

#MealPrep #KitchenTips #HealthyEating #FoodStorage #BudgetMeals #MealPrepSunday #CleanEating #HealthyLifestyle","https://www.daily-life-hacks.com/ways-to-make-grocery-shopping-cheaper","https://www.daily-life-hacks.com/images/pins/how-to-make-grocery-shopping-cheaper_v1.jpg","Ways to Make Grocery Shopping Cheaper","","Ways to Make Grocery Shopping Cheaper - healthy tips tips","","Healthy Meal Prep & Kitchen Tips","","",""
"2026-04-06 17:29","Better than store bought! Creamy high-fiber hummus recipe with extra chickpeas and tahini. Perfect dip for veggies. #HummusRecipe #HealthyDip #HighFiberSnack #Hummus #HealthySnack #PlantBased #HighFiber #MediterraneanFood","https://www.daily-life-hacks.com/high-fiber-hummus-recipe-homemade-tips","https://www.daily-life-hacks.com/images/pins/high-fiber-hummus-recipe-homemade_v3.jpg","High Fiber Hummus Recipe Homemade Tips","","High Fiber Hummus Recipe Homemade - professionally plated meal with fresh vegetables, chickpeas for healthy snacking","","High Fiber Recipes","","",""
"2026-04-07 09:20","Stop letting your produce rot. Discover how to store fruits and vegetables properly to double their lifespan and completely eliminate food waste.

#MealPrep #KitchenTips #HealthyEating #FoodStorage #BudgetMeals #MealPrepSunday #CleanEating #HealthyLifestyle","https://www.daily-life-hacks.com/how-to-properly-store-fruits-and-vegetables-chart","https://www.daily-life-hacks.com/images/pins/how-to-store-fruits-and-vegetables-properly_v3.jpg","How to Properly Store Fruits and Vegetables Chart","","How to Properly Store Fruits and Vegetables Chart - healthy tips tips","","Healthy Meal Prep & Kitchen Tips","","",""
"2026-04-07 11:07","Stop throwing money in the trash. Discover how to reduce food waste at home with easy tips that actually fit into your busy schedule.

#MealPrep #KitchenTips #HealthyEating #FoodStorage #BudgetMeals #MealPrepSunday #CleanEating #HealthyLifestyle","https://www.daily-life-hacks.com/how-to-reduce-food-waste-at-home-easy-tips-guide","https://www.daily-life-hacks.com/images/pins/how-to-reduce-food-waste-at-home-easy-tips_v2.jpg","How to Reduce Food Waste At Home Easy Tips Guide","","How to Reduce Food Waste At Home Easy Tips Guide - healthy tips tips","","Healthy Meal Prep & Kitchen Tips","","",""
"2026-04-07 13:38","You won't believe they are healthy! Fudgy black bean brownies packed with fiber and protein. Gluten-free and guilt-free treat. #BlackBeanBrownies #HealthyDessert #HighFiberSweets #HealthyBrownies #GuiltFreeDessert #HiddenVeggie #HighFiber #GlutenFreeBaking","https://www.daily-life-hacks.com/best-black-bean-brownies-hidden-fiber-dessert","https://www.daily-life-hacks.com/images/pins/black-bean-brownies-hidden-fiber-dessert_v4.jpg","Best Black Bean Brownies Hidden Fiber Dessert","","Black Bean Brownies Hidden Fiber Dessert - appetizing food presentation for natural nutrition","","High Fiber Recipes","","",""
"2026-04-07 14:42","Layer your way to health! Greek yogurt, high-fiber granola and mixed berries parfait. 15g of fiber to start your day. #YogurtParfait #HealthyBreakfast #GutHealth #ParfaitRecipe #HighFiber #BreakfastGoals #GutFriendly #HealthyStart","https://www.daily-life-hacks.com/best-high-fiber-yogurt-parfait-for-breakfast","https://www.daily-life-hacks.com/images/pins/high-fiber-yogurt-parfait-for-breakfast_v4.jpg","Best High Fiber Yogurt Parfait for Breakfast","","High Fiber Yogurt Parfait for Breakfast - fresh meal in glass containers with berries, yogurt for a healthy morning","","High Fiber Recipes","","",""
"2026-04-07 17:20","Popcorn is a whole grain! Healthy high-fiber popcorn toppings: Nutritional yeast, chili lime and cinnamon. Ditch the butter. #HealthyPopcorn #SnackHacks #HighFiber #Popcorn #HealthySnacks #HighFiber #MovieNightSnack #WholeGrain","https://www.daily-life-hacks.com/high-fiber-popcorn-toppings-healthy-guide","https://www.daily-life-hacks.com/images/pins/high-fiber-popcorn-toppings-healthy_v4.jpg","High Fiber Popcorn Toppings Healthy Guide","","High Fiber Popcorn Toppings Healthy - appetizing bowl with colorful ingredients for healthy snacking","","High Fiber Recipes","","",""
"2026-04-08 10:04","A simple 30-day high-fiber meal plan with easy recipes, grocery ideas, and practical daily habits you can actually keep up with. #HighFiberMeals #MealPlanIdeas #GutFriendlyFoods #EasyRecipes #HealthyHabits #WeeklyPrep #SimpleNutrition #DailyRoutine","https://www.daily-life-hacks.com/30-day-high-fiber-challenge-meal-plan-guide","https://www.daily-life-hacks.com/images/pins/30-day-high-fiber-challenge-meal-plan_v4.jpg","30 Day High Fiber Challenge Meal Plan Guide","","Weekly meal planner surrounded by fresh produce, simple recipes, and notes for easy high-fiber meals","","Gut Health & Nutrition Tips","","",""
"2026-04-08 11:51","High-protein, high-fiber meals with beans, chicken, lentils, vegetables, and grains can make dinner feel more balanced and satisfying. #HighProteinHighFiber #BalancedMeals #EasyDinner #MealIdeas #FiberRich #ProteinPacked #SimpleCooking #WeeknightMeals","https://www.daily-life-hacks.com/what-is-a-high-protein-high-fiber-diet","https://www.daily-life-hacks.com/images/pins/high-protein-high-fiber-meals-for-weight-loss_v1.jpg","What Is a High Protein High Fiber Diet","","Balanced plate with lentils, vegetables, grains, and protein arranged for a hearty everyday meal","","High Fiber Recipes","","",""
"2026-04-08 12:53","Feeling overwhelmed by the kitchen? Start here with these totally manageable freezer meal prep ideas for beginners and save your weeknights.

#MealPrep #KitchenTips #HealthyEating #FoodStorage #BudgetMeals #MealPrepSunday #CleanEating #HealthyLifestyle","https://www.daily-life-hacks.com/easy-meal-prep-ideas-to-freeze","https://www.daily-life-hacks.com/images/pins/freezer-meal-prep-ideas-for-beginners_v1.jpg","Easy Meal Prep Ideas to Freeze","","Easy Meal Prep Ideas to Freeze - healthy tips tips","","Healthy Meal Prep & Kitchen Tips","","",""
"2026-04-08 14:52","Popcorn is a whole grain! Healthy high-fiber popcorn toppings: Nutritional yeast, chili lime and cinnamon. Ditch the butter. #HealthyPopcorn #SnackHacks #HighFiber #Popcorn #HealthySnacks #HighFiber #MovieNightSnack #WholeGrain","https://www.daily-life-hacks.com/high-fiber-popcorn-toppings-healthy-tips","https://www.daily-life-hacks.com/images/pins/high-fiber-popcorn-toppings-healthy_v3.jpg","High Fiber Popcorn Toppings Healthy Tips","","High Fiber Popcorn Toppings Healthy - appetizing bowl with colorful ingredients for healthy snacking","","High Fiber Recipes","","",""
"2026-04-08 16:59","Tired of your cilantro turning into green slime? Here is exactly how to store fresh herbs to last longer and save money.

#MealPrep #KitchenTips #HealthyEating #FoodStorage #BudgetMeals #MealPrepSunday #CleanEating #HealthyLifestyle","https://www.daily-life-hacks.com/how-to-make-fresh-herbs-last-longer","https://www.daily-life-hacks.com/images/pins/how-to-store-fresh-herbs-to-last-longer_v4.jpg","How to Make Fresh Herbs Last Longer","","How to Make Fresh Herbs Last Longer - healthy tips tips","","Healthy Meal Prep & Kitchen Tips","","",""
"2026-04-09 09:58","Plant-based power! 5 Days of vegan high-fiber lunches. Tofu, quinoa, roasted veggies. Cheap and easy prep. #VeganMealPrep #HighFiberVegan #PlantBased #VeganPrep #MealPrepSunday #HighFiber #PlantPower #HealthyLunch","https://www.daily-life-hacks.com/best-vegan-high-fiber-meal-prep-for-week","https://www.daily-life-hacks.com/images/pins/vegan-high-fiber-meal-prep-for-week_v3.jpg","Best Vegan High Fiber Meal Prep for Week","","Vegan High Fiber Meal Prep for Week - fresh meal in glass containers with fresh vegetables, whole grains for natural nutrition","","High Fiber Recipes","","",""
"2026-04-09 11:28","Never get bored! 4 Chia Pudding flavors: Chocolate, Berry, Mango and Vanilla. High fiber meal prep breakfast. #ChiaPudding #BreakfastIdeas #HighFiber #ChiaSeeds #HealthyBreakfast #MealPrep #HighFiber #GutHealth","https://www.daily-life-hacks.com/chia-pudding-recipes-for-breakfast","https://www.daily-life-hacks.com/images/pins/chia-pudding-variations-for-breakfast_v4.jpg","Chia Pudding Recipes for Breakfast","","Chia Pudding Variations for Breakfast - overhead view of prepared meal with chia seeds for a healthy morning","","High Fiber Recipes","","",""
"2026-04-09 12:59","You won't believe they are healthy! Fudgy black bean brownies packed with fiber and protein. Gluten-free and guilt-free treat. #BlackBeanBrownies #HealthyDessert #HighFiberSweets #HealthyBrownies #GuiltFreeDessert #HiddenVeggie #HighFiber #GlutenFreeBaking","https://www.daily-life-hacks.com/black-bean-brownies-hidden-fiber-dessert-guide","https://www.daily-life-hacks.com/images/pins/black-bean-brownies-hidden-fiber-dessert_v2.jpg","Black Bean Brownies Hidden Fiber Dessert Guide","","Black Bean Brownies Hidden Fiber Dessert - appetizing food presentation for natural nutrition","","High Fiber Recipes","","",""
"2026-04-09 15:21","Steamed artichoke with lemon and garlic is one of those simple dishes that feels fresh, satisfying, and a little special. #ArtichokeRecipes #GutFriendlyMeals #HighFiberVeggies #VegetarianDinner #MediterraneanFood #FiberRich #SimpleCooking #FreshIngredients","https://www.daily-life-hacks.com/artichoke-recipes-for-gut-health-guide","https://www.daily-life-hacks.com/images/pins/artichoke-recipes-for-gut-health_v3.jpg","Artichoke Recipes for Gut Health","","Artichoke Recipes for Gut Health - steamed artichoke with lemon and garlic on a fresh dinner plate","","High Fiber Recipes","","",""
"2026-04-09 16:53","Popcorn and potato chips may both feel snacky, but the fiber difference makes them a very different fit for everyday snacking. #SnackSwap #FiberFacts #HealthyChoices #SnackIdeas #Popcorn #PotatoChips #SimpleComparison #EverydayNutrition","https://www.daily-life-hacks.com/popcorn-vs-potato-chips-fiber-comparison-tips","https://www.daily-life-hacks.com/images/pins/popcorn-vs-potato-chips-fiber-comparison_v3.jpg","Popcorn Vs Potato Chips Fiber Comparison Tips","","Bowl of popcorn and bowl of potato chips arranged side by side for a quick snack comparison","","Gut Health & Nutrition Tips","","",""
"2026-04-10 09:25","A simple 30-day high-fiber meal plan with easy recipes, grocery ideas, and practical daily habits you can actually keep up with. #HighFiberMeals #MealPlanIdeas #GutFriendlyFoods #EasyRecipes #HealthyHabits #WeeklyPrep #SimpleNutrition #DailyRoutine","https://www.daily-life-hacks.com/best-30-day-high-fiber-challenge-meal-plan","https://www.daily-life-hacks.com/images/pins/30-day-high-fiber-challenge-meal-plan_v3.jpg","Best 30 Day High Fiber Challenge Meal Plan","","Weekly meal planner surrounded by fresh produce, simple recipes, and notes for easy high-fiber meals","","Gut Health & Nutrition Tips","","",""
