"row_id","pin_title","pin_description","alt_text","image_url","board_id","link","scheduled_date","status"
"air-fryer-salmon-bites-garlic-honey-glaze_v1","Air Fryer Salmon Bites With Garlic Honey Glaze","Crispy on the outside, flaky inside, and cooked in under ten minutes. These salmon cubes are tossed in a sticky, sweet soy and honey glaze right after cooking. #AirFryerRecipes #SalmonBites #SeafoodRecipes","Sticky glazed salmon bites served in a bowl over white rice.","https://www.daily-life-hacks.com/images/pins/air-fryer-salmon-bites-garlic-honey-glaze_v1.jpg","1124140825679184032","https://www.daily-life-hacks.com/air-fryer-salmon-bites-garlic-honey-glaze","2026-04-08","PENDING"
"amaranth-millet-teff-beginner-cooking-guide_v1","Beginner's Guide to Cooking Amaranth, Millet, and Teff","Learn the exact water ratios and techniques to cook these three whole grains without them turning to glue. A simple guide to rinsing, toasting, and simmering for perfect texture every time. #WholeGrains #HealthyCooking #MealPrepBasics #PantryStaples","Small bowls of cooked amaranth, millet, and teff on a kitchen counter.","https://www.daily-life-hacks.com/images/pins/amaranth-millet-teff-beginner-cooking-guide_v1.jpg","1124140825679184034","https://www.daily-life-hacks.com/amaranth-millet-teff-beginner-cooking-guide","2026-04-09","PENDING"
"baked-cod-lemon-capers-green-beans_v1","Baked Cod With Lemon, Capers, and Green Beans","A 15-minute prep, single-pan dinner featuring mild cod fillets and crisp green beans. The quick lemon butter and caper sauce adds brightness without extra dishes. Perfect for a weeknight when you want seafood without the stress. #BakedCodRecipe #QuickFishDinner #EasySeafood","Baked cod fillets topped with lemon slices and capers alongside green beans on a baking sheet.","https://www.daily-life-hacks.com/images/pins/baked-cod-lemon-capers-green-beans_v1.jpg","1124140825679184032","https://www.daily-life-hacks.com/baked-cod-lemon-capers-green-beans","2026-04-09","PENDING"
"baking-sheet-liners-parchment-silicone-when-to-use_v1","Baking Sheet Liners: Parchment vs. Silicone Mats","Stop guessing what goes on your pan. A clear comparison of parchment paper, silicone mats, and aluminum foil, and exactly when to use each for the best roasting and baking results. #BakingTips #KitchenTools #FoodPrep #CookingHacks","A baking sheet half lined with parchment paper and half with a silicone mat.","https://www.daily-life-hacks.com/images/pins/baking-sheet-liners-parchment-silicone-when-to-use_v1.jpg","1124140825679184036","https://www.daily-life-hacks.com/baking-sheet-liners-parchment-silicone-when-to-use","2026-04-09","PENDING"
"air-fryer-salmon-bites-garlic-honey-glaze_v2","An 18-Minute Air Fryer Seafood Dinner","Save time and get crispier edges by cutting your salmon into cubes. More surface area means better texture, and the air fryer ensures they cook incredibly fast without drying out. #QuickMeals #HealthyDinner #AirFryerCooking","Crispy cubed salmon resting in an air fryer basket.","https://www.daily-life-hacks.com/images/pins/air-fryer-salmon-bites-garlic-honey-glaze_v2.jpg","1124140825679184032","https://www.daily-life-hacks.com/air-fryer-salmon-bites-garlic-honey-glaze","2026-04-09","PENDING"
"amaranth-millet-teff-beginner-cooking-guide_v2","How to Cook New Whole Grains (Without Ruining Dinner)","Expand your pantry beyond rice and oats with this foolproof method for amaranth, millet, and teff. Save time with clear water ratios and easy meal ideas so your grains don't just sit on the shelf. #CookingHacks #HealthyCarbs #MealPlanning #GrainBowls","Perfectly cooked portions of amaranth, millet, and teff ready for meal prep.","https://www.daily-life-hacks.com/images/pins/amaranth-millet-teff-beginner-cooking-guide_v2.jpg","1124140825679184034","https://www.daily-life-hacks.com/amaranth-millet-teff-beginner-cooking-guide","2026-04-10","PENDING"
"baked-cod-lemon-capers-green-beans_v2","Cook Fish Without Stress: 15-Minute Sheet Pan Dinner","Save time and skip the pan-seared fish smell in your kitchen. Baking cod and green beans on one sheet pan keeps cleanup minimal, and the butter sauce prevents the fish from drying out in the oven. #SheetPanDinner #WeeknightMeals #LemonCaperSauce","A close look at flaky baked cod and roasted green beans on parchment paper.","https://www.daily-life-hacks.com/images/pins/baked-cod-lemon-capers-green-beans_v2.jpg","1124140825679184032","https://www.daily-life-hacks.com/baked-cod-lemon-capers-green-beans","2026-04-10","PENDING"
"baking-sheet-liners-parchment-silicone-when-to-use_v2","Choose the Right Pan Liner for Easy Cleanup","Save your sponges and prevent scrubbing. Learn why parchment is best for roasting veggies, silicone excels at sticky jobs, and foil is your best friend for high-heat broiling. #KitchenHacks #CleaningTips #MealPrep #BakingBasics","Clean removal of baked goods from parchment and silicone lined pans.","https://www.daily-life-hacks.com/images/pins/baking-sheet-liners-parchment-silicone-when-to-use_v2.jpg","1124140825679184036","https://www.daily-life-hacks.com/baking-sheet-liners-parchment-silicone-when-to-use","2026-04-10","PENDING"
"air-fryer-salmon-bites-garlic-honey-glaze_v3","How to Cook Salmon Without Burning the Glaze","The trick is to air fry the fish with dry spices first, then toss it in the warm honey and garlic glaze afterward. This prevents the sugar from burning in the high-speed hot air. #CookingTips #SalmonRecipe #KitchenHacks","Salmon bites being tossed in a bowl with a dark, sticky honey glaze.","https://www.daily-life-hacks.com/images/pins/air-fryer-salmon-bites-garlic-honey-glaze_v3.jpg","1124140825679184032","https://www.daily-life-hacks.com/air-fryer-salmon-bites-garlic-honey-glaze","2026-04-10","PENDING"
"amaranth-millet-teff-beginner-cooking-guide_v3","Why Is Your Millet Bitter? (And How to Fix It)","Tired of guessing how to cook unfamiliar grains? Discover why a quick rinse and dry toast makes all the difference for millet, teff, and amaranth. Get the exact steps to fluffy or creamy textures. #KitchenTips #WholeGrains #CookingGuide #PantryUpgrade","Three distinct whole grains displayed cooked and ready to eat.","https://www.daily-life-hacks.com/images/pins/amaranth-millet-teff-beginner-cooking-guide_v3.jpg","1124140825679184034","https://www.daily-life-hacks.com/amaranth-millet-teff-beginner-cooking-guide","2026-04-11","PENDING"
"baked-cod-lemon-capers-green-beans_v3","How to Cook Cod That Actually Tastes Good","Tired of rubbery, flavorless fish? This baked cod method uses a bright, punchy lemon and caper butter sauce to flavor the fish from the start while protecting it from the heat. #FishRecipes #CookingHacks #SeafoodDinner","Freshly baked cod fillet flaking apart with a fork, covered in lemon butter sauce.","https://www.daily-life-hacks.com/images/pins/baked-cod-lemon-capers-green-beans_v3.jpg","1124140825679184032","https://www.daily-life-hacks.com/baked-cod-lemon-capers-green-beans","2026-04-11","PENDING"
"baking-sheet-liners-parchment-silicone-when-to-use_v3","Why Are Your Cookies Spreading Too Much?","If your cookies flatten out into puddles, your silicone mat might be to blame. Discover why parchment paper gives dough the grip it needs to rise and brown perfectly. #BakingHacks #CookieTips #KitchenTools #DessertPrep","Cookies baked on a silicone mat compared to those on parchment paper.","https://www.daily-life-hacks.com/images/pins/baking-sheet-liners-parchment-silicone-when-to-use_v3.jpg","1124140825679184036","https://www.daily-life-hacks.com/baking-sheet-liners-parchment-silicone-when-to-use","2026-04-11","PENDING"
"air-fryer-salmon-bites-garlic-honey-glaze_v4","Stop Being Intimidated by Cooking Fish at Home","Worrying about flipping a delicate fillet? Cubed salmon bites completely bypass that stress. Just toss them in the basket, shake halfway, and enjoy perfectly cooked fish every time. #EasyDinners #CookingConfidence #Pescatarian","A close-up of a perfectly cooked, flaky salmon bite with a glossy sauce.","https://www.daily-life-hacks.com/images/pins/air-fryer-salmon-bites-garlic-honey-glaze_v4.jpg","1124140825679184032","https://www.daily-life-hacks.com/air-fryer-salmon-bites-garlic-honey-glaze","2026-04-11","PENDING"
"amaranth-millet-teff-beginner-cooking-guide_v4","Stop Pretending Amaranth Is Just Like Rice","Each whole grain behaves differently. Learn why teff needs whisking and amaranth keeps its crunch, so you can stop forcing them into the wrong meals. A realistic approach to your pantry. #FoodHacks #CookingBasics #HealthyEating #PantryStaples","Close-up of the unique textures of cooked amaranth, teff, and millet.","https://www.daily-life-hacks.com/images/pins/amaranth-millet-teff-beginner-cooking-guide_v4.jpg","1124140825679184034","https://www.daily-life-hacks.com/amaranth-millet-teff-beginner-cooking-guide","2026-04-12","PENDING"
"baked-cod-lemon-capers-green-beans_v4","Stop Searing Your Fish on Busy Weeknights","Forget the stovetop mess and the lingering smell. Baking cod with a simple butter and caper sauce is practically foolproof and cooks in the exact same amount of time as the green beans next to it. #EasyDinners #BakedCod #PantryStaples","A single pan showing baked fish and green beans straight out of the oven.","https://www.daily-life-hacks.com/images/pins/baked-cod-lemon-capers-green-beans_v4.jpg","1124140825679184032","https://www.daily-life-hacks.com/baked-cod-lemon-capers-green-beans","2026-04-12","PENDING"
"baking-sheet-liners-parchment-silicone-when-to-use_v4","Silicone Mats Cannot Replace Parchment Paper","I tried replacing all my parchment with silicone mats, and my roasted vegetables steamed instead of browning. Here is why you actually need both liners in your kitchen for different jobs. #OvenRoasting #KitchenSecrets #CookingTips #FoodPrep","Roasted vegetables on parchment paper showing excellent browning.","https://www.daily-life-hacks.com/images/pins/baking-sheet-liners-parchment-silicone-when-to-use_v4.jpg","1124140825679184036","https://www.daily-life-hacks.com/baking-sheet-liners-parchment-silicone-when-to-use","2026-04-12","PENDING"
"air-fryer-salmon-bites-garlic-honey-glaze_v5","The Dinner Cheat Code for When You Forgot to Plan","It feels like ordering from a trendy food truck, but it takes less time than choosing a show to watch. Pair these snackable bites with quick rice and roasted veggies for a full meal. #LazyCooking #WeeknightMeals #FastFoodAlternative","A simple weeknight meal setup featuring glazed salmon bites and a side of vegetables.","https://www.daily-life-hacks.com/images/pins/air-fryer-salmon-bites-garlic-honey-glaze_v5.jpg","1124140825679184032","https://www.daily-life-hacks.com/air-fryer-salmon-bites-garlic-honey-glaze","2026-04-12","PENDING"
"amaranth-millet-teff-beginner-cooking-guide_v5","The Golden Rule for Cooking Amaranth, Millet, and Teff","Always rinse, sometimes toast, then simmer and rest. Follow this simple framework to master these whole grains on a busy weeknight. Includes practical meal templates for each grain. #QuickRecipes #WholeGrains #CookingTips #MealPrep","A spoon resting near small bowls of perfectly prepared millet, teff, and amaranth.","https://www.daily-life-hacks.com/images/pins/amaranth-millet-teff-beginner-cooking-guide_v5.jpg","1124140825679184034","https://www.daily-life-hacks.com/amaranth-millet-teff-beginner-cooking-guide","2026-04-13","PENDING"
"baked-cod-lemon-capers-green-beans_v5","A Fancy Seafood Dinner When You Hate Doing Dishes","This looks like a meal that requires effort, but it is basically just throwing ingredients on a piece of parchment paper. The fish flakes perfectly, the green beans get tender, and cleanup takes a minute. #LazyCooking #OnePanMeal #SeafoodRecipes","Plated serving of baked cod, green beans, and lemon caper sauce on a white plate.","https://www.daily-life-hacks.com/images/pins/baked-cod-lemon-capers-green-beans_v5.jpg","1124140825679184032","https://www.daily-life-hacks.com/baked-cod-lemon-capers-green-beans","2026-04-13","PENDING"
"baking-sheet-liners-parchment-silicone-when-to-use_v5","The Rule of Thumb for Baking Sheet Liners","Use parchment for general baking and browning. Grab the silicone mat for candy, macarons, and sticky dough. Use foil for high-heat broiling. Your oven results will be instantly better. #BakingAdvice #KitchenTools #CookingHacks #MealPrep","Foil, parchment, and silicone mats arranged as kitchen tool options.","https://www.daily-life-hacks.com/images/pins/baking-sheet-liners-parchment-silicone-when-to-use_v5.jpg","1124140825679184036","https://www.daily-life-hacks.com/baking-sheet-liners-parchment-silicone-when-to-use","2026-04-13","PENDING"
"balanced-breakfast-that-keeps-you-full_v1","How to Build a Balanced Breakfast","Learn how to build a balanced breakfast that keeps you full without requiring an hour of meal prep. Focus on combining a carbohydrate, a protein, and a little bit of fat or fiber. #BalancedBreakfast #HealthyEating #MorningRoutine #NutritionTips","A balanced breakfast plate with eggs, toast, and avocado next to coffee.","https://www.daily-life-hacks.com/images/pins/balanced-breakfast-that-keeps-you-full_v1.jpg","1124140825679184036","https://www.daily-life-hacks.com/balanced-breakfast-that-keeps-you-full","2026-04-09","PENDING"
"balanced-breakfast-that-keeps-you-full_v3","Why Are You Always Hungry by 10 AM?","If you grab a plain piece of toast and coffee, your blood sugar spikes and crashes fast. Fix it by adding a source of protein like Greek yogurt or eggs to slow things down. #NutritionAdvice #MorningHacks #HealthyBreakfast #EatingWell","A complete breakfast layout showing eggs, whole grain toast, and a side of avocado.","https://www.daily-life-hacks.com/images/pins/balanced-breakfast-that-keeps-you-full_v3.jpg","1124140825679184036","https://www.daily-life-hacks.com/balanced-breakfast-that-keeps-you-full","2026-04-11","PENDING"
"balanced-breakfast-that-keeps-you-full_v4","Stop Eating Just a Bagel for Breakfast","You do not need to cut out the bagel, but eating quick carbohydrates alone leads to a crash. Add an egg or some avocado to invite protein and fat to the party. #NutritionTips #BalancedDiet #BreakfastTips #HealthyChoices","Bagel paired with a protein-rich egg and avocado slices.","https://www.daily-life-hacks.com/images/pins/balanced-breakfast-that-keeps-you-full_v4.jpg","1124140825679184036","https://www.daily-life-hacks.com/balanced-breakfast-that-keeps-you-full","2026-04-12","PENDING"
"balanced-breakfast-that-keeps-you-full_v5","3 Simple Components for a Filling Morning Meal","You only need three things for a breakfast that works: a carbohydrate, a protein, and fat or fiber. Try oatmeal with peanut butter and Greek yogurt for an easy start. #EasyBreakfast #MealFormula #NutritionFacts #HealthyEating","Oatmeal bowl topped with peanut butter and a side of yogurt.","https://www.daily-life-hacks.com/images/pins/balanced-breakfast-that-keeps-you-full_v5.jpg","1124140825679184036","https://www.daily-life-hacks.com/balanced-breakfast-that-keeps-you-full","2026-04-13","PENDING"
