date,subreddit,title,url,link_used,upvotes_24h,upvotes_7d,notes
2026-07-12,r/EatCheapAndHealthy,We ranked 53 foods by grams of fiber per dollar. Dry split peas crushed it.,,https://daily-life-hacks.com/fiber-per-dollar-cheapest-high-fiber-foods/,,,status=draft_ready; draft=pipeline-data/reddit-drafts/01.md; priority=post_today
2026-07-12,r/EatCheapAndHealthy,Protein per dollar: dried pinto beans vs chicken breast vs eggs (real July 2026 prices),,https://daily-life-hacks.com/protein-per-dollar-cheapest-protein-sources/,,,status=draft_ready; draft=pipeline-data/reddit-drafts/02.md; priority=post_today
2026-07-12,r/mealprep,High fiber burrito bowl meal prep that still tastes good on Thursday,,https://daily-life-hacks.com/high-fiber-burrito-bowl-meal-prep/,,,status=draft_ready; draft=pipeline-data/reddit-drafts/03.md; priority=post_today
2026-07-12,r/Frugal,"Closing the fiber gap (~15g → ~28g) without buying fancy ""gut"" products",,https://daily-life-hacks.com/how-to-eat-more-fiber-on-a-budget-complete-guide/,,,status=draft_ready; draft=pipeline-data/reddit-drafts/04.md
2026-07-12,r/cooking,Same-day quick soak for dried beans (no overnight planning),,https://daily-life-hacks.com/how-to-quick-soak-dried-beans-same-day/,,,status=draft_ready; draft=pipeline-data/reddit-drafts/05.md
2026-07-12,r/mealprep,Meal prep for one on a budget: 5 lunches that do not look sad,,https://daily-life-hacks.com/how-to-meal-prep-on-a-budget-for-one-person/,,,status=draft_ready; draft=pipeline-data/reddit-drafts/06.md
2026-07-12,r/slowcooking,Split pea soup as a fiber workhorse (~16g per bowl),,https://daily-life-hacks.com/split-pea-soup-recipe-high-fiber/,,,status=draft_ready; draft=pipeline-data/reddit-drafts/07.md
2026-07-12,r/vegetarian,Complete protein without powders: beans + grains across the day,,https://daily-life-hacks.com/beans-and-rice-complete-protein-meal/,,,status=draft_ready; draft=pipeline-data/reddit-drafts/08.md
2026-07-12,r/Frugal,The $60 week dinner framework (2 adults). What stayed / what broke,,https://daily-life-hacks.com/eat-healthy-on-a-budget-complete-playbook/,,,status=draft_ready; draft=pipeline-data/reddit-drafts/09.md
2026-07-12,r/cooking,Cast iron seasoning without the mythology,,https://daily-life-hacks.com/how-to-season-cast-iron-skillet-properly/,,,status=draft_ready; draft=pipeline-data/reddit-drafts/10.md
